Numbered Topic,Topic,Subtopic,Subsubtopic,Learning Outcome,Code
001.Introduction to Data,Introduction to Data,Topic Outcome,,Identify variables as numerical and categorical.,1.1.1.0
001.Introduction to Data,Introduction to Data,Topic Outcome,,"Define associated variables as variables that show some relationship with one another. Further categorize this relationship as positive or negative association, when possible.",1.1.1.1
001.Introduction to Data,Introduction to Data,Topic Outcome,,Define variables that are not associated as independent.,1.1.1.2
001.Introduction to Data,Introduction to Data,Topic Outcome,,"Identify the explanatory variable in a pair of variables as the variable suspected of affecting the other. However, note that labeling variables as explanatory and response does not guarantee that the relationship between the two is actually causal, even if there is an association identified between the two variables.",1.1.1.3
001.Introduction to Data,Introduction to Data,Topic Outcome,,"Classify a study as observational or experimental, and determine and explain why whether the study's results can be generalized to the population and whether they suggest correlation or causation between the variables studied.",1.1.1.4
001.Introduction to Data,Introduction to Data,Topic Outcome,,Question confounding variables and sources of bias in a given study.,1.1.1.5
001.Introduction to Data,Introduction to Data,Topic Outcome,,"Distinguish between simple random, stratified, cluster, and multistage sampling, and recognize the benefits and drawbacks of choosing one sampling scheme over another.",1.1.1.6
001.Introduction to Data,Introduction to Data,Topic Outcome,,"Identify the four principles of experimental design and recognize their purposes control any possible confounders, randomize into treatment and control groups, replicate by using a sufficiently large sample or repeating the experiment, and block any variables that might influence the response.",1.1.1.7
001.Introduction to Data,Introduction to Data,Topic Outcome,,Identify if single or double blinding has been used in a study.,1.1.1.8
002.Summarizing Data,Summarizing Data,Topic Outcome,,"Use scatterplots for describing the relationship between two numerical variables making sure to note the direction (positive or negative), form (linear or non-linear) and the strength of the relationship as well as any unusual observations that stand out.",2.1.1.0
002.Summarizing Data,Summarizing Data,Topic Outcome,,"When describing the distribution of a numerical variable, mention its shape, center, and spread, as well as any unusual observations.",2.1.1.1
002.Summarizing Data,Summarizing Data,Topic Outcome,,Note that there are three commonly used measures of center and spread.,2.1.1.2
002.Summarizing Data,Summarizing Data,Topic Outcome,,"Identify the shape of a distribution as symmetric, right skewed, or left skewed, and unimodal, bimodal, multimodal, or uniform.",2.1.1.3
002.Summarizing Data,Summarizing Data,Topic Outcome,,"Use histograms and box plots to visualize the shape, center, and spread of numerical distributions, and intensity maps for visualizing the spatial distribution of the data.",2.1.1.4
002.Summarizing Data,Summarizing Data,Topic Outcome,,"Define a robust statistic (e.g. median, IQR) as measures that are not heavily affected by skewness and extreme outliers, and determine when they are more appropriate measured of center and spread compared to other similar statistics.",2.1.1.5
002.Summarizing Data,Summarizing Data,Topic Outcome,,"Recognize when transformations (e.g. log) can make the distribution of data more symmetric, and hence easier to model.",2.1.1.6
002.Summarizing Data,Summarizing Data,Topic Outcome,,Use frequency tables and bar plots to describe the distribution of one categorical variable.,2.1.1.7
002.Summarizing Data,Summarizing Data,Topic Outcome,,Use contingency tables and segmented bar plots or mosaic plots to assess the relationship between two categorical variables.,2.1.1.8
002.Summarizing Data,Summarizing Data,Topic Outcome,,Use side-by-side box plots for assessing the relationship between a numerical and a categorical variable.,2.1.1.9
002.Summarizing Data,Summarizing Data,Topic Outcome,,"Note that an observed difference in sample statistics suggesting dependence between variables may be due to random chance, and that we need to use hypothesis testing to determine if this difference is too large to be attributed to random chance.",2.1.1.10
002.Summarizing Data,Summarizing Data,Topic Outcome,,"Set up null and alternative hypotheses for testing for independence between variables, and evaluate data's support for these hypotheses using a simulation technique.",2.1.1.11
003.Probability,Probability,Topic Outcome,,"Define trial, outcome, and sample space.",3.1.1.0
003.Probability,Probability,Topic Outcome,,"Explain why the long-run relative frequency of repeated independent events settle down to the true probability as the number of trials increases, i.e. why the law of large numbers holds.",3.1.1.1
003.Probability,Probability,Topic Outcome,,Distinguish disjoint (also called mutually exclusive) and independent events.,3.1.1.2
003.Probability,Probability,Topic Outcome,,Draw Venn diagrams representing events and their probabilities.,3.1.1.3
003.Probability,Probability,Topic Outcome,,"Define a probability distribution as a list of the possible outcomes with corresponding probabilities that satisfies three rules; the outcomes listed must be disjoint, each probability must be between 0 and 1, inclusive and the probabilities must total 1.",3.1.1.4
003.Probability,Probability,Topic Outcome,,Define complementary outcomes as mutually exclusive outcomes of the same random process whose probabilities add up to 1.,3.1.1.5
003.Probability,Probability,Topic Outcome,,Distinguish between union of events (A or B) and intersection of events (A and B).,3.1.1.6
003.Probability,Probability,Topic Outcome,,Calculate the probability of union of events using the (general) addition rule.,3.1.1.7
003.Probability,Probability,Topic Outcome,,Distinguish marginal and conditional probabilities.,3.1.1.8
003.Probability,Probability,Topic Outcome,,Calculate the probability of intersection of independent events using the multiplication rule.,3.1.1.9
003.Probability,Probability,Topic Outcome,,Construct tree diagrams to calculate conditional probabilities and probabilities of intersection of non-independent events using Bayes' theorem.,3.1.1.10
003.Probability,Probability,Topic Outcome,,Sampling without replacement from a small population means we no longer have independence between our observations.,3.1.1.11
003.Probability,Probability,Topic Outcome,,A random variable is a random process or variable with a numerical outcome. Modeling a process using a random variable allows us to apply a mathematical framework and statistical principles for better understanding and predicting outcomes in the real world.,3.1.1.12
003.Probability,Probability,Topic Outcome,,We use measures of center and spread to define distributions of random variables.,3.1.1.13
003.Probability,Probability,Topic Outcome,,"Expected value and variance of a discrete random variable, X, can be calculated.",3.1.1.14
003.Probability,Probability,Topic Outcome,,Standard deviation is the square root of variance. We use standard deviation also as a measure of the variability of the random variable. Standard deviation is often easier to interpret since it's in the same units of the random variable.,3.1.1.15
003.Probability,Probability,Topic Outcome,,Linear combinations of random variables.,3.1.1.16
003.Probability,Probability,Topic Outcome,,Probability density functions represent the distributions of continuous random variables.,3.1.1.17
004.Distributions of random variables,Distributions of random variables,Topic Outcome,,Define the standardized (Z) score of a data point as the number of standard deviations it is away from the mean.,4.1.1.0
004.Distributions of random variables,Distributions of random variables,Topic Outcome,,Use the Z score,4.1.1.1
004.Distributions of random variables,Distributions of random variables,Topic Outcome,,"Depending on the shape of the distribution determine whether the median would have a negative, positive, or 0 Z score.",4.1.1.2
004.Distributions of random variables,Distributions of random variables,Topic Outcome,,Assess whether or not a distribution is nearly normal using the 68-95-99.7\% rule or graphical methods such as a normal probability plot.,4.1.1.3
004.Distributions of random variables,Distributions of random variables,Topic Outcome,,"If X is a random variable that takes the value 1 with probability of success p and 0 with probability of success 1-p, then X is a Bernoulli random variable.",4.1.1.4
004.Distributions of random variables,Distributions of random variables,Topic Outcome,,The geometric distribution is used to describe how many trials it takes to observe a success.,4.1.1.5
004.Distributions of random variables,Distributions of random variables,Topic Outcome,,Define the probability of finding the first success in the $n^{th}$ trial as $(1-p)^{n-1}p$.,4.1.1.6
004.Distributions of random variables,Distributions of random variables,Topic Outcome,,"Determine if a random variable is binomial using the four conditions; the trials are independent, the number of trials n is fixed, each trial outcome can be classified as a success or failure and the probability of a success p is the same for each trial.",4.1.1.7
004.Distributions of random variables,Distributions of random variables,Topic Outcome,,Calculate the number of possible scenarios for obtaining $k$ successes in $n$ trials using the choose function ${n \choose k} = \frac{n!}{k!~(n - k)!}$.,4.1.1.8
004.Distributions of random variables,Distributions of random variables,Topic Outcome,,Calculate probability of a given number of successes in a given number of trials using the binomial distribution $P(k = K) = \frac{n!}{k!~(n - k)!}~p^k~(1-p)^{(n - k)}$.,4.1.1.9
004.Distributions of random variables,Distributions of random variables,Topic Outcome,,Calculate the expected number of successes in a given number of binomial trials $(\mu = np)$ and its standard deviation $(\sigma = \sqrt{np(1-p)})$.,4.1.1.10
004.Distributions of random variables,Distributions of random variables,Topic Outcome,,"When number of trials is sufficiently large ($np \ge 10$ and $n(1-p) \ge 10$), use normal approximation to calculate binomial probabilities, and explain why this approach works.",4.1.1.11
004.Distributions of random variables,Distributions of random variables,Topic Outcome,,Cumulative density function and probability mass functions.,4.1.1.12
005.Foundations for inference,Foundations for inference,Topic Outcome,,"Define sample statistic as a point estimate for a population parameter, for example, the sample proportion is used to estimate the population proportion, and note that point estimate and sample statistic are synonymous.",5.1.1.0
005.Foundations for inference,Foundations for inference,Topic Outcome,,"Recognize that point estimates (such as the sample proportion) will vary from one sample to another, and define this variability as sampling variation.",5.1.1.1
005.Foundations for inference,Foundations for inference,Topic Outcome,,"Calculate the sampling variability of the proportion, the standard error, as $SE = \sqrt{\frac{p(1-p)}{n}}$, where $p$ is the population proportion.",5.1.1.2
005.Foundations for inference,Foundations for inference,Topic Outcome,,"Standard error measures the variability in point estimates from different samples of the same size and from the same population, i.e. measures the sampling variability.",5.1.1.3
005.Foundations for inference,Foundations for inference,Topic Outcome,,Recognize that when the sample size increases we would expect the sampling variability to decrease.,5.1.1.4
005.Foundations for inference,Foundations for inference,Topic Outcome,,Notice that sampling distributions of point estimates coming from samples that don't meet the required conditions for the CLT (about sample size and independence) will not be normal.,5.1.1.5
005.Foundations for inference,Foundations for inference,Topic Outcome,,Define a confidence interval as the plausible range of values for a population parameter.,5.1.1.6
005.Foundations for inference,Foundations for inference,Topic Outcome,,Define the confidence level as the percentage of random samples which yield confidence intervals that capture the true population parameter.,5.1.1.7
005.Foundations for inference,Foundations for inference,Topic Outcome,,Calculate an approximate 95\% confidence interval by adding and subtracting 2 standard errors to the point estimate; $point~estimate \pm 2 \times SE$.,5.1.1.8
005.Foundations for inference,Foundations for inference,Topic Outcome,,"Recognize that the Central Limit Theorem (CLT) is about the distribution of point estimates, and that given certain conditions, this distribution will be nearly normal.",5.1.1.9
005.Foundations for inference,Foundations for inference,Topic Outcome,,Recall that independence of observations in a sample is provided by random sampling (in the case of observational studies) or random assignment (in the case of experiments).,5.1.1.10
005.Foundations for inference,Foundations for inference,Topic Outcome,,"Recognize that the nearly normal distribution of the point estimate (as suggested by the CLT) implies that a more precise confidence interval can be calculated as $point~estimate \pm z^{\star} \times SE$, where $z^{\star}$ corresponds to the cutoff points in the standard normal distribution to capture the middle XX\% of the data, where XX\% is the desired confidence level.",5.1.1.11
005.Foundations for inference,Foundations for inference,Topic Outcome,,"Define margin of error as the distance required to travel in either direction away from the point estimate when constructing a confidence interval, i.e. $z^{\star} \times SE$.",5.1.1.12
005.Foundations for inference,Foundations for inference,Topic Outcome,,"Interpret a confidence interval as ``We are XX\% confident that the true population parameter is in this interval"", where XX\% is the desired confidence level.",5.1.1.13
005.Foundations for inference,Foundations for inference,Topic Outcome,,Explain how the hypothesis testing framework resembles a court trial.,5.1.1.14
005.Foundations for inference,Foundations for inference,Topic Outcome,,"Recognize that in hypothesis testing we evaluate two competing claims, the null and alternative hypothesis.",5.1.1.15
005.Foundations for inference,Foundations for inference,Topic Outcome,,Construction of hypotheses.,5.1.1.16
005.Foundations for inference,Foundations for inference,Topic Outcome,,Define a p-value as the conditional probability of obtaining a sample statistic at least as extreme as the one observed given that the null hypothesis is true.,5.1.1.17
005.Foundations for inference,Foundations for inference,Topic Outcome,,"Calculate a p-value as the area under the normal curve beyond the observed sample proportion (either in one tail or both, depending on the alternative hypothesis).",5.1.1.18
005.Foundations for inference,Foundations for inference,Topic Outcome,,Infer that if a confidence interval does not contain the null value the null hypothesis should be rejected in favor of the alternative.,5.1.1.19
005.Foundations for inference,Foundations for inference,Topic Outcome,,Compare the p-value to the significance level to make a decision between the hypotheses.,5.1.1.20
005.Foundations for inference,Foundations for inference,Topic Outcome,,Note that the conclusion of a hypothesis test might be erroneous regardless of the decision we make.,5.1.1.21
005.Foundations for inference,Foundations for inference,Topic Outcome,,Choose a significance level depending on the risks associated with Type 1 and Type 2 errors.,5.1.1.22
005.Foundations for inference,Foundations for inference,Topic Outcome,,Formulate the framework for statistical inference using hypothesis testing and nearly normal point estimates.,5.1.1.23
005.Foundations for inference,Foundations for inference,Topic Outcome,,"If the conditions necessary for the CLT to hold are not met, note this and do not go forward with the analysis. (We will later learn about methods to use in these situations.)",5.1.1.24
005.Foundations for inference,Foundations for inference,Topic Outcome,,Distinguish statistical significance vs. practical significance.,5.1.1.25
006.Inference for categorical data,Inference for categorical data,Topic Outcome,,Define population proportion $p$ (parameter) and sample proportion $\hat{p}$ (point estimate).,6.1.1.0
006.Inference for categorical data,Inference for categorical data,Topic Outcome,,"Calculate the sampling variability of the proportion, the standard error.",6.1.1.1
006.Inference for categorical data,Inference for categorical data,Topic Outcome,,"Recognize that the Central Limit Theorem (CLT) is about the distribution of point estimates, and that given certain conditions, this distribution will be nearly normal.",6.1.1.2
006.Inference for categorical data,Inference for categorical data,Topic Outcome,,"Note that if the CLT doesn't apply and the sample proportion is low (close to 0) the sampling distribution will likely be right skewed, if the sample proportion is high (close to 1) the sampling distribution will likely be left skewed.",6.1.1.3
006.Inference for categorical data,Inference for categorical data,Topic Outcome,,Remember how confidence intervals and test statistics are calculated.,6.1.1.4
006.Inference for categorical data,Inference for categorical data,Topic Outcome,,"Note that the standard error calculation for the confidence interval and the hypothesis test are different when dealing with proportions, since in the hypothesis test we need to assume that the null hypothesis is true -- remember; p-value = P(observed or more extreme test statistic $|$ $H_0$ true).",6.1.1.5
006.Inference for categorical data,Inference for categorical data,Topic Outcome,,"Calculate the required minimum sample size for a given margin of error at a given confidence level, and explain why we use $\hat{p} = 0.5$ if there are no previous studies suggesting a more accurate estimate.",6.1.1.6
006.Inference for categorical data,Inference for categorical data,Topic Outcome,,Note that the calculation of the standard error of the distribution of the difference in two independent sample proportions is different for a confidence interval and a hypothesis test.,6.1.1.7
006.Inference for categorical data,Inference for categorical data,Topic Outcome,,"Note that the reason for the difference in calculations of standard error is the same as in the case of the single proportion; when the null hypothesis claims that the two population proportions are equal, we need to take that into consideration when calculating the standard error for the hypothesis test, and use a common proportion for both samples.",6.1.1.8
006.Inference for categorical data,Inference for categorical data,Topic Outcome,,Use a chi-square test of goodness of fit to evaluate if the distribution of levels of a single categorical variable follows a hypothesized distribution.,6.1.1.9
006.Inference for categorical data,Inference for categorical data,Topic Outcome,,Calculate the expected counts for a given level (cell) in a one-way table as the sample size times the hypothesized proportion for that level.,6.1.1.10
006.Inference for categorical data,Inference for categorical data,Topic Outcome,,Calculate the chi-square test statistic.,6.1.1.11
006.Inference for categorical data,Inference for categorical data,Topic Outcome,,"Note that the chi-square distribution is right skewed with one parameter; degrees of freedom. In the case of a goodness of fit test, $df = \# \text{of categories} - 1$.",6.1.1.12
006.Inference for categorical data,Inference for categorical data,Topic Outcome,,List the conditions necessary for performing a chi-square test (goodness of fit or independence).,6.1.1.13
006.Inference for categorical data,Inference for categorical data,Topic Outcome,,Describe how to use the chi-square table to obtain a p-value.,6.1.1.14
006.Inference for categorical data,Inference for categorical data,Topic Outcome,,"When evaluating the independence of two categorical variables where at least one has more than two levels, use a chi-square test of independence.",6.1.1.15
006.Inference for categorical data,Inference for categorical data,Topic Outcome,,Calculate expected counts in two-way tables.,6.1.1.16
006.Inference for categorical data,Inference for categorical data,Topic Outcome,,"Calculate the degrees of freedom for chi-square test of independence as $df = (R - 1) \times (C - 1)$, where $R$ is the number of rows in a two-way table, and $C$ is the number of columns.",6.1.1.17
006.Inference for categorical data,Inference for categorical data,Topic Outcome,,"Note that there is no such thing as a chi-square confidence interval for proportions, since in the case of a categorical variables with many levels, there isn't one parameter to estimate.",6.1.1.18
006.Inference for categorical data,Inference for categorical data,Topic Outcome,,Use simulation methods when sample size conditions aren't met for inference for categorical variables.,6.1.1.19
006.Inference for categorical data,Inference for categorical data,Topic Outcome,,"In hypothesis testing; for one categorical variable, generate simulated samples based on the null hypothesis, and then calculate the number of samples that are at least as extreme as the observed data. For two categorical variables, use a randomization test.",6.1.1.20
006.Inference for categorical data,Inference for categorical data,Topic Outcome,,Use bootstrap methods for confidence intervals for categorical variables with at most two levels.,6.1.1.21
007.Inference for numerical data,Inference for numerical data,Topic Outcome,,"Use the $t$-distribution for inference on a single mean, difference of paired (dependent) means, and difference of independent means.",7.1.1.0
007.Inference for numerical data,Inference for numerical data,Topic Outcome,,"Explain why the $t$-distribution helps make up for the additional variability introduced by using $s$ (sample standard deviation) in calculation of the standard error, in place of $\sigma$ (population standard deviation).",7.1.1.1
007.Inference for numerical data,Inference for numerical data,Topic Outcome,,"Describe how the $t$-distribution is different from the normal distribution, and what ?heavy tail? means in this context.",7.1.1.2
007.Inference for numerical data,Inference for numerical data,Topic Outcome,,"Note that the $t$-distribution has a single parameter, degrees of freedom, and as the degrees of freedom increases this distribution approaches the normal distribution.",7.1.1.3
007.Inference for numerical data,Inference for numerical data,Topic Outcome,,"Use a $t$-statistic, with degrees of freedom $df = n - 1$ for inference for a population mean.",7.1.1.4
007.Inference for numerical data,Inference for numerical data,Topic Outcome,,Describe how to obtain a p-value for a $t$-test and a critical $t$-score ($t^\star_{df}$) for a confidence interval.,7.1.1.5
007.Inference for numerical data,Inference for numerical data,Topic Outcome,,Define observations as paired if each observation in one dataset has a special correspondence or connection with exactly one observation in the other data set.,7.1.1.6
007.Inference for numerical data,Inference for numerical data,Topic Outcome,,"Carry out inference for paired data by first subtracting the paired observations from each other, and then treating the set of differences as a new numerical variable on which to do inference (such as a confidence interval or hypothesis test for the average difference).",7.1.1.7
007.Inference for numerical data,Inference for numerical data,Topic Outcome,,Calculate the standard error of the difference between means of two paired (dependent) samples as $SE = \frac{s_{diff}}{\sqrt{n_{diff}}}$ and use this standard error in hypothesis testing and confidence intervals comparing means of paired (dependent) groups.,7.1.1.8
007.Inference for numerical data,Inference for numerical data,Topic Outcome,,"Use a $t$-statistic, with degrees of freedom $df = n_{diff} - 1$ for inference for a population mean.",7.1.1.9
007.Inference for numerical data,Inference for numerical data,Topic Outcome,,Recognize that a good interpretation of a confidence interval for the difference between two parameters includes a comparative statement (mentioning which group has the larger parameter).,7.1.1.10
007.Inference for numerical data,Inference for numerical data,Topic Outcome,,Recognize that a confidence interval for the difference between two parameters that doesn't include 0 is in agreement with a hypothesis test where the null hypothesis that sets the two parameters equal to each other is rejected.,7.1.1.11
007.Inference for numerical data,Inference for numerical data,Topic Outcome,,"Calculate the standard error of the difference between means of two independent samples as $SE = \sqrt{\frac{s_1^2}{n_1} + \frac{s_2^2}{n_2}}$, and use this standard error in hypothesis testing and confidence intervals comparing means of independent groups.",7.1.1.12
007.Inference for numerical data,Inference for numerical data,Topic Outcome,,"Use a $t$-statistic, with degrees of freedom $df = min(n_1 - 1, n_2 - 1)$ for inference for a population mean.",7.1.1.13
007.Inference for numerical data,Inference for numerical data,Topic Outcome,,"Calculate the power of a test for a given effect size and significance level in two steps; (1) Find the cutoff for the sample statistic that will allow the null hypothesis to be rejected at the given significance level, (2) Calculate the probability of obtaining that sample statistic given the effect size.",7.1.1.14
